{
  "case_id": "SF-013",
  "classification": "OFFICIAL",
  "events": [
    {
      "accepted_anomaly_types": [],
      "accepted_entity_aliases": [
        "frontend-68d8bbfdc8-8mnzh"
      ],
      "anomaly_type": "MEMORY_USAGE_INCREASE",
      "entity_id": "d4bb49b4-6fb8-4a07-aaf6-e2caff5df974",
      "entity_type": "Pod",
      "evidence_rubric": "Public container_memory_working_set_bytes samples support the Pod memory increase.",
      "gt_event_id": "EVT-0001",
      "gt_version": "FINAL-GT-TAXONOMY-20261020-v2",
      "observable_end_time": "2026-10-20T05:53:34.987000+00:00",
      "observable_start_time": "2026-10-20T05:48:49.987000+00:00",
      "review_status": "APPROVED",
      "rubric_version": "final-strict-positive-credit-1.1"
    }
  ],
  "excluded_groups": [],
  "matching_rule_version": "final-strict-positive-credit-1.1",
  "review_status": "APPROVED",
  "rubric_version": "final-strict-positive-credit-1.1",
  "source_candidate_manifest_sha256": "012c1a428cf618987f305d659b1be2ea7b8d7e11416c16086c5705990660af7d",
  "source_candidate_sha256": "7c9d221a0606b878cb29e63eb111b301aae1d88d8d9005a04aba0c03c40ffecb",
  "source_public_manifest_sha256": "3328c73eaf8533d343b6452cb4cd14d3708b2adacc9757b9f593941a8895ab7c",
  "status": "APPROVED",
  "task_type": "FINAL_ANOMALY_INVESTIGATION",
  "time_tolerance_seconds": 120,
  "version": "FINAL-GT-TAXONOMY-20261020-v2"
}
